{
  "schema_version": "0.6",
  "command": "promote",
  "ok": false,
  "exit_code": 5,
  "data": {
    "gate": {
      "feature": "feat-x",
      "feature_head": "d7407485ce685c126afcfc258f0a9eeb0092d776",
      "public_main": "007a3f6399026b4d9b9af3c155edf5ad99c6baa7",
      "overlay": "a1ef151295bf2b53d15b18523ab0184d02178bbd",
      "candidate": "ad7c1d9752519d03b74752a472ecf072aacd2fb7",
      "published_tree": "ef9061717144a4bf03a0230d8f8926d019f2adeb",
      "scanned_as": "preserve",
      "commits": [
        {
          "source": "d7407485ce685c126afcfc258f0a9eeb0092d776",
          "subject": "work",
          "author": "Test Author <author@example.com>",
          "files": [
            "feature.txt"
          ]
        }
      ],
      "checks": "passed",
      "failed_checks": [],
      "leak": "clean",
      "findings": [],
      "waived": [],
      "repo_guards": {
        "mode": "rewrite",
        "rewritten": [],
        "unrewritable": []
      },
      "shadow_pr": null,
      "reused": true,
      "preview": null
    },
    "plan": {
      "schema_version": "0.6",
      "id": "20261005T120005Z-0c0d0e",
      "kind": "promote",
      "actor": "human:octo",
      "created_at": "2026-10-05T12:00:05Z",
      "pair": {
        "public": "acme/widget",
        "shadow": "acme/widget-shadow"
      },
      "feature": "feat-x",
      "mode": "squash",
      "fingerprint": {
        "public_main": "007a3f6399026b4d9b9af3c155edf5ad99c6baa7",
        "feature_head": "d7407485ce685c126afcfc258f0a9eeb0092d776",
        "overlay": "a1ef151295bf2b53d15b18523ab0184d02178bbd",
        "gate_candidate": "ad7c1d9752519d03b74752a472ecf072aacd2fb7"
      },
      "curate": null,
      "publish": {
        "commit": "15dd9c9bcb7655bdb426fb4a24f440fc9c31fb65",
        "tree": "ef9061717144a4bf03a0230d8f8926d019f2adeb",
        "parent": "007a3f6399026b4d9b9af3c155edf5ad99c6baa7",
        "target_branch": "feat-x",
        "pr": {
          "title": "Add feature",
          "body": ""
        },
        "commits": [
          {
            "commit": "15dd9c9bcb7655bdb426fb4a24f440fc9c31fb65",
            "tree": "ef9061717144a4bf03a0230d8f8926d019f2adeb",
            "parent": "007a3f6399026b4d9b9af3c155edf5ad99c6baa7",
            "sources": [
              "d7407485ce685c126afcfc258f0a9eeb0092d776"
            ],
            "author": {
              "name": "octo",
              "email": "42+octo@users.noreply.github.com",
              "date": "2026-10-05T12:00:05Z"
            },
            "subject": "Add feature"
          }
        ],
        "dropped_empty": []
      },
      "leak": {
        "findings": [],
        "waived": [],
        "warnings": [],
        "scanner_version": "gitleaks v8.30.1"
      },
      "ci": {
        "repo_guards": {
          "mode": "rewrite",
          "rewritten": [],
          "unrewritable": []
        }
      }
    },
    "plan_path": "<ROOT>/home/workspaces/default/plans/20261005T120005Z-0c0d0e.json",
    "findings": [],
    "waived": [],
    "applied": null,
    "preview": null
  },
  "warnings": [],
  "next": [
    {
      "command": [
        "ghostbranch",
        "apply",
        "20261005T120005Z-0c0d0e"
      ],
      "why": "publish the plan: a person runs this in their own terminal and types the code it shows (or allows agents first with ghostbranch agents allow)",
      "needs_human": true,
      "needs_input": []
    }
  ],
  "error": {
    "code": "APPROVAL_REQUIRED",
    "message": "not confirmed; plan 20261005T120005Z-0c0d0e is saved",
    "field": null,
    "retryable": false,
    "details": {
      "plan_id": "20261005T120005Z-0c0d0e",
      "reason": "not_confirmed"
    }
  }
}
