{
  "schema_version": "0.6",
  "command": "init",
  "ok": true,
  "exit_code": 0,
  "data": {
    "public": "acme/widget",
    "shadow": "acme/widget-shadow",
    "created_shadow": true,
    "adopted": false,
    "resumed": false,
    "mirrored_branches": [
      "main"
    ],
    "mirrored_tags": [],
    "overlay_created": true,
    "default_branch_set": true,
    "audit": {
      "public": "acme/widget",
      "shadow": "acme/widget-shadow",
      "guards": [],
      "guard_mode": "rewrite",
      "secrets": {
        "referenced": [],
        "listed": false,
        "missing": [],
        "inherit": [],
        "environments": []
      },
      "push_triggers": [],
      "minutes": {
        "billed": true,
        "scheduled_sync": null
      },
      "overlay": [
        {
          "path": ".github/workflows/ghostbranch-sync.yml",
          "status": "current"
        }
      ]
    },
    "preview": null
  },
  "warnings": [
    {
      "code": "ACTIONS_MINUTES_BILLED",
      "message": "acme/widget-shadow is private, so its Actions minutes are billed"
    }
  ],
  "next": [],
  "error": null
}
